<?xml version="1.0" encoding="UTF-8"?>
<notification xmlns="https://github.com/nikolina97/xws-tim16-siit-2019"
 xmlns:xsi="http://www.w3.org/2001/XMLSchema-instance"
 xsi:schemaLocation="https://github.com/nikolina97/xws-tim16-siit-2019 file:/D:/xml/projekatv2/xws-tim16-siit-2019/backend/src/main/resources/schemas/notification.xsd" id="id1" date="2006-05-04">
    <scientificPaperId>scientificPaperId0</scientificPaperId>
    <from>
        <fromId>fromId0</fromId>
        <fromEmail>fromEmail0</fromEmail>
    </from>
    <to>
        <toId>toId0</toId>
        <toEmail>toEmail0</toEmail>
    </to>
    <text>text0</text>
</notification>
